{
  "schemaVersion": "golden-path-source-integrity/v1",
  "checkedAt": "2026-08-10T15:02:07Z",
  "standardVersion": "2026.08.6",
  "releaseVersion": "1.6.0",
  "integrityRecords": [
    {
      "path": "go.sum",
      "sha256": "9203aa84ace88cad86637acca28de173e5adbf28fd8baa786a1ff32199450cfc"
    },
    {
      "path": "mise.lock",
      "sha256": "0720116a8dff9aa53f18af3dca2c19f8e3b07e0d64ed067f4a89408e82b38c71"
    },
    {
      "path": "templates/bundle.json",
      "sha256": "7d5b3ffbaea94cc1b79917e3fcd879b3909f08a35add2349191598a933c445e3"
    },
    {
      "path": "templates/profiles/go/go.sum.tmpl",
      "sha256": "17fca5f51216eac1b0741c569ef1456c08acecc99b95327ab66720a3f112348b"
    },
    {
      "path": "templates/profiles/node-typescript/pnpm-lock.base.yaml.tmpl",
      "sha256": "b989ffdce281860be196e3da56b183a71854c43fac0e64316db09f941d0c4fe2"
    },
    {
      "path": "templates/profiles/node-typescript/pnpm-lock.cdk.yaml.tmpl",
      "sha256": "250306a9792b34ace38a7be5353cea1a2c00cc66ddba3c209cbf6a3ba6cf638f"
    },
    {
      "path": "templates/profiles/node-typescript/pnpm-lock.pulumi.yaml.tmpl",
      "sha256": "f262c9e36b0de97915774498665a92f843a6cc24f8f6cfd4d18630023358f02c"
    },
    {
      "path": "templates/profiles/python/.python-version.tmpl",
      "sha256": "54447b334a0e618b8695f5793a9c931c15320490bbbda173ae96809133e6412f"
    },
    {
      "path": "templates/profiles/python/uv.lock.tmpl",
      "sha256": "1e529c44218ab4b36a190f4f3f372458290f9a051c2fdea4ea176b498bcd5b89"
    },
    {
      "path": "templates/profiles/rust/rust-toolchain.toml.tmpl",
      "sha256": "a4dcbec5f6f0a1f8ebb62633e4e1d386c2586909fe3a00ccbf871e32e43b06e2"
    },
    {
      "path": "templates/tooling/mise.lock",
      "sha256": "592303996fd11dda3776f7d912ba12b1536051e0dfc62215e8288d2381f904c5"
    }
  ]
}
